name,address
Barren River Lake State Resort Park,"1149 State Park Rd Lucas, KY 42156"
Boots Randolph Golf Course,"US Hwy 68 & Hwy 1489 Cadiz, KY 42211"
Bright Leaf Golf Resort,"1742 Danville Rd Harrodsburg, KY 40330"
Calvert City Golf & Country Club,"123 Country Club Ln Calvert City, KY 42029"
Carter Caves State Resort Park Golf Course,"Route 5 Olive Hill, KY 41164"
Dale Hollow Lake State Resort Park Golf Course,"6371 State Park Road Burkesville, KY 42717"
General Burnside Island State Park,"8801 South Hwy 27 Burnside, KY 42519"
Grayson Lake Golf Course,"314 Grayson Lake Park Road Olive Hill, KY 41164"
John James Audubon State Park Golf Course,"3100 US Highway 41 North Henderson, KY 42420"
Kentucky Dam Village State Resort Park,"Hwy 641 S Gilbertsville, KY 42044"
Lake Barkley Golf Course,"3500 State Park Road Hwy 68 Cadiz, KY 42211"
Lake Cumberland Golf Club ,"500 Lily Creek Resort Road Jamestown, KY 42629"
Lincoln Homestead State Park Golf Course,"5079 Lincoln Park Rd Springfield, KY 40069"
My Old Kentucky Home State Park Golf Course,"668 Loretto Road Bardstown, KY 40004"
Park Mammoth Golf Club ,"823 Bald Knob Road Park City, KY 42160"
Pennyrile Forest State Park Resort,"20781 Pennyrile Lodge Rd Dawson Springs, KY 42408"
Tanglewood Golf Course,"245 Tanglewood Ct Taylorsville, KY 40071"
The Cullan at Mineral Mound State Park Golf Club,"48 Finch Lane Eddyville, KY 42038"
Wasioto Winds Golf Course at Pine Mountain,"1050 State Park Rd Pineville, KY 40977"
Yatesville Lake State Park Golf Course,"1410 Golf Course Road Louisa, KY 41230"
A. J. Jolly Golf Course,"5350 S US Hwy 27 Alexandria, KY 41001"
American Legion Park Par 3 Golf Course,"N Miles St at Park Ln Elizabethtown, KY 42701"
Andover Golf & Country Club,"3450 Todds Rd Lexington, KY 40509"
Arrowhead Golf Club,"14 Arrowhead Blvd Cadiz, KY 42211"
Audubon Country Club,"3265 Robin Rd Louisville, KY 40213"
Avon Golf Course,"5751 Briar Hill Rd Lexington, KY 40516"
Ballard County Country Club,"2145 LaCenter Rd LaCenter, KY 42056"
Bardstown Country Club at Maywood,"130 Maywood Avenue Bardstown, KY 40004"
Battlefield Golf Course,"524 General Cruft Dr Richmond, KY 40475"
Beattyville Country Club,"Country Club Rd Beattyville, KY 41311"
Beaver Valley Golf Course,"Golf Course Rd Allen, KY 41601"
Beechfork Golf Club,"1476 Pompeii Rd Clay City, KY 40312"
Bellarmine College Golf Course ,"2000 Norris Pl Louisville, KY 40205"
Bellefonte Country Club,"208 Country Club Dr Ashland, KY 41101"
Ben Hawes Park Golf Course,"400 Boothfield Rd Owensboro, KY 42301"
Benton Golf & Country Club,"1830 Golf Course Rd Benton, KY 42025"
Berea Country Club,"104 Churchill Court Berea, KY 40403"
Big Hickory Golf Course & Country Club,"Rural Route 5 Manchester, KY 40962"
Big Spring Country Club,"5901 Dutchmans Ln Louisville, KY 40205"
Bobby Nichols Golf Course,"4301 E Pages Ln Louisville, KY 40272"
Boone Links Golf Course,"19 Clubhouse Dr Florence, KY 41042"
Bowling Green Country Club,"251 Beech Bend Rd Bowling Green, KY 42101"
Breckenridge County Community Center,"Hwy 261 S Hardinsburg, KY 40143"
Breckenridge Golf & Country Club,"240 Whitaker Way Morganfield, KY 42437"
Campbellsville Country Club,"3064 Hodgenville Rd. Campbellsville, KY 42718"
Canewood Golf Course,"124 General John Payne Georgetown, KY 40324"
Cardinal Club,"401 Champions Way Simpsonville, KY 40067"
Cardinal Hills Golf Course,"Rural Route 2 Bedford, KY 40006"
Carnico Golf Club,"800 Lakeside Dr Carlisle, KY 40311"
Cassell Creek Golf Course,"4199 Lexington Rd Winchester, KY 40391"
Caveland Country Club,"2968 S Dixie Hwy Horse Cave, KY 42749"
Caveland Par 3,"6172 Happy Valley Rd Cave City, KY 42127"
Cedar Point Golf Course,"21676 Louisville Rd Park City, KY 42160"
Cedar Rapids Country Club,"US Hwy 150 W Mount Vernon, KY 40456"
Cedar-Fil Golf Course,"2330 New Shepherdsville Rd Bardstown, KY 40004"
Central City Country Club,"Fairway Dr Central City, KY 42330"
Charlie Vettiner Golf Course,"10207 Mary Dell Lane Louisville, KY 40299"
Cherokee Golf Course,"2501 Alexander Rd Louisville, KY 40204"
Cherry Blossom Golf Club,"150 Clubhouse Drive Georgetown, KY 40324"
Cherry Grove Golf Course,"1006 Dixie Bee Line Hwy Trenton, KY 42286"
Clear Creek Golf Course,"717 Burks Branch Rd Shelbyville, KY 40065"
Coal Ridge Golf Course,"100 Coal Ridge Ln Georgetown, KY 40324"
Cole Park Golf Course,"1601 Club Loop Fort Campbell, KY 42223"
Connemara Golf Course,"2327 Lexington Rd Nicholasville, KY 40356"
Country Club of Paducah,"6500 Turnberry Dr Paducah, KY 42001"
Crescent Hill Golf Course,"3110 Brownsboro Rd Louisville, KY 40206"
Crooked Creek Golf Club,"781 Crooked Creek Dr London, KY 40744"
CrossWinds Golf Course,"1031 Wilkinson Trace Bowling Green, KY 42103"
Cynthiana Country Club,"1127 Ky Highway 36 E Cynthiana, KY 41031"
Danville Country Club,"1486 Lexington Avenue Danville, KY 40422"
Deer Lakes Golf Course,"140 Deer Lakes Lane Salem, KY 42078"
Devou Park Golf Course,"1344 Audubon Rd Covington Covington, KY 41011"
Diamond Caverns Resort & Golf Club,"660 Doyle Rd Park City, KY 42160"
Diamond Links Golf Club,"200 Fairway Dr Catlettsburg, KY 41129"
Dix River Country Club,"Lancaster Rd Stanford, KY 40484"
Doe Valley Golf Club,"540 Valley Green Road Brandenburg, KY 40108"
Dogwood Hills,"Hwy 62 Cunningham, KY 42035"
Drake Creek Country Club,"1 Torrey Pines Dr Ledbetter, KY 42058"
Duckers Lake Golf Course,"98 Buena Vista Drive Frankfort, KY 40601"
Dunmor Lakeside Golf Course,"Hwy 973 Dunmor, KY 42339"
Eagle Creek,"2820 S Hwy 53 La Grange, KY 40031"
Eagle Creek Country Club,"990 Critttenden Rd Mt Zion Crittenden, KY 41030"
Eagle Trace Golf Course,"1275 Eagle Drive Morehead, KY 40351"
Eagles Nest Country Club,"2320 Clubhouse Rd. Somerset, KY 42503"
Elizabethtown Country Club,"2606 Hodgenville Rd Elizabethtown, KY 42701"
Elk Fork Country Club,"West Main St Elkton, KY 42220"
Elkwood Golf Course,"Hwy 10911675 Hwy 60 W Sturgis, KY 42459"
Estill County Golf Club,"Kirkland Ave Irvine, KY 40336"
Fairway Golf Course,"4940 Hwy 227 N Wheatley, KY 40359"
Flagg Springs Golf Course,"3670 Smith Rd. California, KY 41007"
Fleming County Golf Association,"Route 3 Flemingsburg, KY 41041"
Fort Mitchell Country Club,"250 Fort Mitchell Ave Fort Mitchell, KY 41011"
Fox Hollow Golf Club,"280 Club House Ln Glasgow, KY 42141"
Fox Run - Kenton County,"3908 Richardson Rd Independence, KY 41051"
Frankfort Country Club,"101 Duntreath St Frankfort, KY 40601"
Franklin Country Club,"302 Broadway Ave Franklin, KY 42134"
"Gay Brewer, Jr. Course at Picadome","469 Parkway Drive Lexington, KY 40504"
General Butler State Resort ,"1608 Highway 227 Carrollton, KY 41008"
Gibson Bay Golf Course,"2000 Gibson Bay Dr Richmond, KY 40475"
Glasgow Golf & Country Club,"350 Country Club Ln Glasgow, KY 42141"
Glenmary Golf Club,"10200 Glenmary Farm Dr Louisville, KY 40291"
GlenOaks Country Club,"10601 Worthington Ln Prospect, KY 40059"
Golf Course at Riverview,"1200 West Main Street Bowling Green, KY 42104"
Green County Country Club,"158 Golf Course Rd Greensburg, KY 42743"
Green Meadow Country Club,"6887 North Mayo Trail Pikeville, KY 41501"
Greenbrier Golf & Country Club,"2179 Bahama Rd Lexington, KY 40509"
Greenville Country Club,"Elkton Rd Greenville, KY 42345"
Griffin Gate Golf Club,"1800 Newtown Pike Lexington, KY 40511"
Harlan Country Club,"Hwy 421 South Harlan, KY 40831"
Harmony Landing Country Club,"13201 Reading Rd Goshen, KY 40026"
Hazard Country Club,"102 Cardinal Dr Hazard, KY 41701"
Henderson Country Club,"1030 Country Club Dr Henderson, KY 42420"
Henderson Municipal Golf Course,"1801 N Elm St Henderson, KY 42420"
Henry County Country Club,"2200 Campbellsburg Road New Castle, KY 40050"
Heritage Hill Golf Club,"1050 Valley View Drive Shepherdsville, KY 40165"
Hickman Country Club,"2779 State Route 125 Hickman, KY 42050"
Hickory Hills Country Club,"1552 Short Town Rd Liberty, KY 42539"
Hickory Pointe Golf Course,"6740 Flemingsburg Rd Morehead, KY 40351"
Hickory Sticks Golf Club,"3812 Painter Rd California, KY 41007"
Hidden Hills Golf & Country Club,"586 Country Club Lane Tompkinsville, KY 42167"
Hidden Valley Golf Course,"530 Hidden Valley Rd Morgantown, KY 42261"
Highland Country Club,"931 Alexandria Pike Fort Thomas, KY 41075"
Hillcrest Country Club,"517 Lawrence St Brandenburg, KY 40108"
Hillcrest Municipal Golf Course,"1234 owensboro, ky 1234"
Hobson Grove Golf Course,"W Main St Bowling Green, KY 42101"
Hopkinsville Golf & Country Club,"303 Country Club Ln Hopkinsville, KY 42240"
Houston Oaks Golf Course,"555 Houston Oaks Drive Paris, KY 40361"
Hunting Creek Country Club,"6807 Foxcroft Road Prospect, KY 40059"
Hurstbourne Country Club,"9000 Hurstbourne Club Lane Louisville, KY 40222"
Idle Hour Country Club,"1815 Richmond Rd Lexington, KY 40502"
Indian Hills Country Club,"200 Indian Hills Dr Bowling Green, KY 42103"
Indian Springs Country Club,"Route 6 Barbourville, KY 40906"
Indian Springs Golf Club ,"3408 Indian Lake Dr Louisville, KY 40241"
Iroquois Golf Course,"1501 Rundill Rd Louisville, KY 40214"
Jenny Wiley State Resort Park,"75 Jenny Wiley Theater Ct Prestonsburg, KY 41653"
Juniper Hills Golf Course,"800 Louisville Rd Frankfort, KY 40601"
Kearney Hills Golf Links,"3403 Kearney Rd Lexington, KY 40511"
Keene Trace Golf Club - Champion Trace Course,"20 Ave of Champions Nicholasville, KY 40356"
Keene Trace Golf Club - Keene Run Course,"5600 Harrodsburg Road Nicholasville, KY 40356"
Kenlake State Resort Park,"542 Kenlake Rd Hardin, KY 42048"
Kenny Perrys Country Creek Golf Course,"1075 Kenny Perry Dr Franklin, KY 42134"
Kentucky Hills Golf Course,"6198 Randolph-Summer Shd Summer Shade, KY 42166"
Kerry Landing Golf Course,"805 Valhalla Ln Benton, KY 42025"
Kincaid Lake State Park,"565 Kincaid Park Road Falmouth, KY 41040"
Knob View Golf Course,"11980 S Preston Hwy Lebanon Junction, KY 40150"
Lafayette Golf Club,"57 Jennie Green Rd Falls of Rough, KY 40119"
Lake Forest Country Club,"14000 Landmark Dr Louisville, KY 40245"
Lake Shore Country Club,"1000 Shamrock Dr Madisonville, KY 42431"
Lakes Golf Club,"Route 2 Maloneton, KY 41175"
Lakeside Golf Course,"3725 Richmond Rd Lexington, KY 40509"
Lakeview Golf & Tennis Club,"397 Golf Course Rd Leitchfield, KY 42754"
Lakeview Springs Golf Complex,"112 Park Ave Frankfort, KY 40601"
Lakewood Country Club,"4214 Hwy 379 Russell Springs, KY 42642"
LaRue County Country Club,"1175 Greensburg Rd Hodgenville, KY 42748"
Lassing Pointe Golf Course,"2266 Double Eagle Dr Union, KY 41091"
Laurel Oaks Golf Club,"808 US Hwy 62 Maysville, KY 41056"
Lebanon Country Club,"655 Country Club Dr Lebanon, KY 40033"
Lexington Country Club,"2550 Paris Pike Lexington, KY 40511"
Lincoln Trail Country Club,"900 Country Club Rd Vine Grove, KY 40175"
Lindsey Golf Course,"4024 Bullion Blvd Fort Knox, KY 40121"
London Country Club,"835 W Laurel Rd London, KY 40741"
Lone Oak Country Club,"44 Club Lane Nicholasville, KY 40340"
Long Run Golf Course,"1605 Flat Rock Rd Eastwood, KY 40245"
Longview Golf Course,"3423 Frankfort Pike Rd Georgetown, KY 40324"
Lost River Golf Club,"453 Rigelwood Lane Bowling Green, KY 42101"
Louisville Country Club,"40 Mockingbird Valley Rd Louisville, KY 40207"
Madison Country Club,"Red House Rd Richmond, KY 40476"
Madisonville City Park Municipal Course,"755 Park Ave Madisonville, KY 42431"
Madisonville Country Club,"1 Country Club Lon Madisonville, KY 42431"
Maplehurst Golf Course,"700 Bells Mill Rd Shepherdsville, KY 40165"
Marion Country Club,"651 S Blackburn St Marion, KY 42064"
Mayfield-Graves Country Club,"1301 W Broadway St Mayfield, KY 42066"
Maysville Country Club,"1099 Hwy 68 S Maysville, KY 41056"
Maywood Golf Club,"130 Maywood Ave Bardstown, KY 40004"
Meadowbrook Golf Course,"400 Wilson Downing Rd Lexington, KY 40517"
Meadowood Golf Club,"1911 Golf Club Dr Burlington, KY 41005"
Meadows Golf Course,"365 Fife Lick Rd Clay City, KY 40312"
Middlesboro Country Club,"Haywood Rd Middlesboro, KY 40965"
Midland Trail Golf Club,"15360 Shelbyville Road Louisville, KY 40245"
Midtown Golf Course,"1125 Jackson St Paducah, KY 42003"
Miller Memorial Golf Course,"2814 Pottertown Road Murray, KY 42071"
Monticello Country Club,"400 Country Club Dr Monticello, KY 42633"
Morehead State University Golf Course,"US 60 E Morehead, KY 40351"
Moss Hill Golf Course,"3495 McCowans Ferry Rd Versailles, KY 40383"
Mount Sterling Golf & Country Club,"1223 Carmargo Rd Mount Sterling, KY 40353"
Mountain Pub-Links Golf Course,"26 Hurt Branch Rd Pikeville, KY 41501"
Murray Country Club,"2200 College Farm Rd. Murray, KY 42071"
Nevel Meade Golf Club,"3123 Nevel Meade Dr Prospect, KY 40059"
Oak Hill Country Club,"Hwy 51 N Clinton, KY 42031"
Oaks Country Club,"Oaks Rd Murray, KY 42071"
Ohio County Country Club,"1153 Country Club Rd Hartford, KY 42347"
Old Bridge Golf Club,"1 Old Bridge Rd Danville, KY 40422"
Old Silo Golf Club,"350 Silver Lake Dr Mt. Sterling, KY 40353"
Oldham County Country Club,"1870 Country Club Ln La Grange, KY 40031"
Owensboro Country Club,"400 E Byers Ave Owensboro, KY 42303"
Owl Creek Country Club,"12400 Osage Rd Anchorage, KY 40223"
Oxmoor Country Club,"9000 Limehouse Ln Louisville, KY 40220"
Paintsville Country Club,"2960 Country Club Rd Paintsville, KY 41240"
Panther Creek Golf Club,"4641 Hwy 1514 Panther, KY 42376"
Paul Walker Golf Course,"1044 Covington Ave Bowling Green, KY 42103"
Paxton Park Golf Course,"841 Berger Road Paducah, KY 42003"
Pendleton Country Club,"Hwy 27 Butler, KY 41040"
Peninsula Golf Resort,"136 Club House Dr Lancaster, KY 40444"
Pennsylvania Run Golf Course,"12900 Christman Rd Louisville, KY 40229"
Perry Park Golf Resort,"595 Springport Ferry Rd Perry Park, KY 40363"
Persimmon Ridge Golf Club,"72 Persimmon Ridge Drive Louisville, KY 40245"
Pine Valley Golf Resort,"850 Pine Valley Dr Elizabethtown, KY 42701"
Pinewood Country Club,"281 Country Club Rd Columbia, KY 42728"
Pioneer Golf Course,"2091 KingSton Hwy Bldg 529 Richmond, KY 40475"
Planters Row Golf Links,"2080 Lexington Rd Nicholasville, KY 40356"
Players Club of Henderson,"Wolf Hills Blvd Henderson, KY 42420"
Princeton Golf & Country Club,"Old Eddieville Rd Princeton, KY 42445"
Providence Golf & Country Club,"Westerfield Dr Providence, KY 42450"
Quail Chase Golf Club,"7000 Cooper Chapel Rd Louisville, KY 40229"
Raven Rock Golf Course,"586 Golf Course Lane Jenkins, KY 41537"
River Bend Golf Club,"Route 1 Argillite, KY 41121"
River Road Country Club ,"2930 Upper River Rd Louisville, KY 40206"
Rolling Hills Country Club,"700 Lake View Dr Paducah, KY 42003"
Rolling Hills Golf Course,"1600 Pine Dr Russellville, KY 42276"
Rosewood Golf & Country Club,"520 Fairway Drive Lebabon, KY 40033"
Rough Creek Golf Course,"11500 E KY Hwy 136 Livermore, KY 42352"
Rough River Dam State Resort Park Golf Course,"450 Lodge Rd Falls of Rough, KY 40119"
Russellville Country Club,"1710 S Nashville Rd Russellville, KY 42276"
Ryland Lakes Country Club,"Route 5 Covington, KY 41015"
Sandy Creek Golf Course,"9701 Meade Springer Rd Ashland, KY 41102"
Scottsville Country Club,"51 John Kelly Dr Scottsville, KY 42164"
Seneca Golf Course,"2300 Peewee Reese Rd Louisville, KY 40205"
Shady Brook Golf Club,"444 Hutchison Rd Paris, KY 40361"
Shawnee Golf Course,"460 NWern Pkwy Louisville, KY 40212"
Shelbyville Country Club,"Smithfield Rd Shelbyville, KY 40065"
Sheltowee Trail Country Club,"1200 Clear Fork Rd N Morehead, KY 40351"
Shively Municipal Golf Course,"2275 Crums Ln Shively, KY 40216"
Silos Country Club,"11435 State Route 286 Kevil, KY 42053"
Slate Branch Golf Course,"795 Slate Branch Rd Somerset, KY 42503"
Sleepy Hollow Country Club,"325 Golf Course Rd Cumberland, KY 40823"
Sleepy Hollow Golf Course,"4221 S Hwy 1694 Prospect, KY 40059"
Somerset Country Club,"N Hwy 1247 Somerset, KY 42502"
South Highland Country Club,"3313 St Route 303 Mayfield, KY 42066"
South Park Country Club,"915 S Park Rd Fairdale, KY 40118"
Southwind Golf Course,"2480 New Boonesboro Rd Winchester, KY 40391"
Spring Valley Golf Club,"2300 Sandersville Rd Lexington, KY 40511"
Standard Country Club,"8208 Brownsboro Rd Louisville, KY 40241"
Stearns Golf Course,"Clubhouse Rd Stearns, KY 42647"
StoneCrest Golf Course,"918 Clubhouse Dr Prestonsburg, KY 41653"
Stoner Creek Golf Club,"38 E Main St Paris, KY 40361"
Sugar Bay Golf Course,"Rural Route 1 Warsaw, KY 41095"
Sullivans Par 3,"1647 N 16th St Murray, KY 42071"
Summit Hills Country Club,"236 Dudley Rd Crestview Hills, KY 41017"
Sun Valley Golf Course,"6505 Bethany Ln Valley Station, KY 40272"
Sundowner Golf Course,"4135 State Route 5 Ashland, KY 41102"
Sweet Hollow Golf Course,"424 Sweet Hollow Rd Corbin, KY 40701"
Tates Creek Golf Course,"1400 Gainesway Dr Lexington, KY 40517"
The Arlington Club,"1510 Lexington Rd Richmond, KY 40475"
The Bays Fork,"60 The Trace Dr Alvaton, KY 42122"
The Brook Golf Course,"2260 Lexington Rd Versailles, KY 40383"
The Bull at Boones Trace,"175 Glen Eagle Blvd Richmond, KY 40475"
The Club at Olde Stone,"950 Village Way Bowling Green, KY 42103"
The Crossings Golf Club,"205 Letts Rd Brooks, KY 40109"
The Golf Complex,"5980 US Highway 60 Paducah, KY 42001"
The Golf Course,"690 Airport Rd Williamsburg, KY 40769"
The Kenton Station Golf Course,"1306 Golf Manor Dr Maysville, KY 41056"
The Links At Novadell,"500 Nova Dell Way Hopkinsville, KY 42240"
The Marvel Golf Club at Kentucky Lake,"466 Bay Hill Drive Benton, KY 42025"
The Oaks Golf Club,"1000 Oaks Dr Flatwoods, KY 41139"
The Polo Fields,"17001 Polo Fields Ln Louisville, KY 40245"
The Summit Country Club,"6501 Summit Dr Owensboro, KY 42303"
The Willow - Kenton County,"3908 Richardson Rd Independence, KY 41051"
The Winchester Country Club,"410 Boone Ave Winchester, KY 40391"
Thoroughbred Golf Club,"1215 Highpoint Dr. Nicholasville, KY 40356"
Traditions Golf Club,"2035 Williams Rd Hebron, KY 41005"
Tri-County Country Club,"Hwy 25 E Corbin, KY 40701"
Triple Crown Country Club,"1 Triple Crown Blvd Union, KY 41091"
Tuckaway Farms,"14400 Ft Campbell Blvd Oak Grove, KY 42262"
Twin Oak Golf Course,"180 Twin Oak Dr Greenville, KY 42345"
Twin Oaks Golf & Plantation Club,"43rd & Michigan Ave Covington, KY 41015"
University Club of Kentucky,"4850 Leestown Rd Lexington, KY 40511"
Valhalla Golf Club,"15503 Shelbyville Rd Louisville, KY 40245"
Weissinger Hills Golf Course,"2240 Mount Eden Road Shelbyville, KY 40065"
Western Hills Golf Course,"2160 Russellville Rd Hopkinsville, KY 42240"
Westwood Country Club,"270 N Country Club Ln Paducah, KY 42001"
Wild Turkey Trace,"1450 Fox Creek Rd. Lawrenceburg, KY 40342"
Wildwood Country Club,"5000 Bardstown Rd Louisville, KY 40291"
Wildwood Golf Course,"264 State Route 2839 Dixon, KY 42409"
Windridge Country Club,"5044 Millers Mill Rd Owensboro, KY 42303"
Windward Heights Country Club,"Hwy 271 S Hawesville, KY 42348"
Woodhaven Country Club,"7200 Woodhaven Rd Louisville, KY 40291"
Woodlawn Springs Golf Club,"103 Woodhill Rd Bardstown, KY 40004"
Woodson Bend Resort,"14 Woodson Bend Bronston, KY 42518"
World of Sport Golf Course,"7400 Woodspoint Dr Florence, KY 41042"
World of Sports,"7400 Woodspoint Drive Florence, KY 41042"
